,name,code,x1,x2,x3,x,x_nonumber,morph,morph_sum,labels_kse,labels_fics,morph_sumdart,cluster
102,BGF리테일,282330,2017년 인적분할하여 설립된 신설법인으로 2017년 12월 유가증권시장에 재상장되어 거래가 개시됨.,"동사는 편의점 체인화 사업을 영위하고 있으며, 당사의 종속회사는 물류사업, 식품제조 및 유통 등 당사의 업무를 보조하는 업무를 수행하고 있음.","브랜드 독립에 맞춰 차별화된 한국형 편의점 모델을 개발하였으며, 가맹점의 수익성과 운영 편리성을 향상시킴으로써 점포 개발 경쟁력 또한 갖추고 있음.","2017년 인적분할하여 설립된 신설법인으로 2017년 12월 유가증권시장에 재상장되어 거래가 개시됨. 동사는 편의점 체인화 사업을 영위하고 있으며, 당사의 종속회사는 물류사업, 식품제조 및 유통 등 당사의 업무를 보조하는 업무를 수행하고 있음. 브랜드 독립에 맞춰 차별화된 한국형 편의점 모델을 개발하였으며, 가맹점의 수익성과 운영 편리성을 향상시킴으로써 점포 개발 경쟁력 또한 갖추고 있음.","인적분할하여 설립된 신설법인으로 유가증권시장에 재상장되어 거래가 개시됨. 동사는 편의점 체인화 사업을 영위하고 있으며, 당사의 종속회사는 물류사업, 식품제조 및 유통 등 당사의 업무를 보조하는 업무를 수행하고 있음. 브랜드 독립에 맞춰 차별화된 한국형 편의점 모델을 개발하였으며, 가맹점의 수익성과 운영편리성을 향상시킴으로써 점포개발 경쟁력 또한 갖추고 있음.","['인적', '분할', '설립', '신설', '법인', '2017년 12월', '유가증권', '시장', '상장', '거래', '개시', '동사', '편의점', '체인', '사업', '영위', '당사', '종속', '회사', '물류', '사업', '식품', '제조', '유통', '당사', '업무', '보조', '업무', '수행', '브랜드', '독립', '차별', '한국', '편의점', '모델', '개발', '가맹점', '수익', '운영', '편리', '향상', '점포', '개발', '경쟁력']",인적 분할 설립 신설 법인 2017년 12월 유가증권 시장 상장 거래 개시 동사 편의점 체인 사업 영위 당사 종속 회사 물류 사업 식품 제조 유통 당사 업무 보조 업무 수행 브랜드 독립 차별 한국 편의점 모델 개발 가맹점 수익 운영 편리 향상 점포 개발 경쟁력 ,유통업,도소매,편의점 사업 주 비지 프 리 테일 당사 분할 기준일 분할 존속 회사 주 비지에프 비지에프 리 테일 인적분할 신설 법인 내용 인적분 현황 포함 가락 시영점 오픈 편의점 체인화사업 시작 낙후 개인 슈퍼 비교 소비자 편의 포맷 제시 소비자 생활속 밀접 소매점 자리 시작 물류 POS 시스템 서비스 상품 편의점 체인화사업 네트워크 확립 준비 과정 사업 배경 우호 시장 환경 성장 소자본 창업 수요 맹 망자 폭발 증가 점포수 증가 우호 환경 조성 당사 네트워크 시스템 그레이드 전국 점포 망 네트워크 완성 당사 PB 상품 콜 센 터 운영 편의점 관련 시스템 업그레이드 일 본훼미 리 마 트사 라이선스 계약 종료 당사 독자 브랜드 CU 성공 런칭 한국 시장 한국 형 편의점 모델 정립 가맹점 수익 중심 운영 전략 우량점 중심 출점 편의점 시장 선도 역할 당사 연결 대상 사업 부문 다음 구 분근 자 파견 대행 업무 위탁 운영 사업 물류 사업 주 비지에프 로지스 당사 물류 사업 비지에프리테일 가맹점 공급 기반 운영 공급 영역 국내 섬지역 울릉도 대청 백령도 제주도 포함 지역 물류 사업 범위 개별 고객 기업 조달 생산 보관 유통 관리 수배송 서비스 당사 전국 물류 센터 보유 기반 물류 효율 고객 요구 사항 부응 편의점 소분 물류 노하우 기반 시스템 기반 최상 서비스 최적 물류 비용 제공 인적 분할 설립 신설 법인 2017년 12월 유가증권 시장 상장 거래 개시 동사 편의점 체인 사업 영위 당사 종속 회사 물류 사업 식품 제조 유통 당사 업무 보조 업무 수행 브랜드 독립 차별 한국 편의점 모델 개발 가맹점 수익 운영 편리 향상 점포 개발 경쟁력 ,9
103,BNK금융지주,138930,"동사는 2011년 부산은행, BNK투자증권, BNK신용정보, BNK캐피탈이 공동으로 주식의 포괄적 이전 방식에 의해 설립한 지방은행 최초의 금융지주회사임.",2015년 경남은행의 계열사 편입으로 부산/경남은행 두 은행 체제가 되었음.,"2015년에 GS자산운용(BNK자산운용 사명 변경)을 자회사로 편입하여 은행, 증권, 자산운용, 여신전문, 저축은행업 등을 포괄하는 종합금융그룹이 되었음. 2019년 11월 BNK벤처투자 자회사 편입.","동사는 2011년 부산은행, BNK투자증권, BNK신용정보, BNK캐피탈이 공동으로 주식의 포괄적 이전 방식에 의해 설립한 지방은행 최초의 금융지주회사임. 2015년 경남은행의 계열사 편입으로 부산/경남은행 두 은행 체제가 되었음. 2015년에 GS자산운용(BNK자산운용 사명 변경)을 자회사로 편입하여 은행, 증권, 자산운용, 여신전문, 저축은행업 등을 포괄하는 종합금융그룹이 되었음. 2019년 11월 BNK벤처투자 자회사 편입.","동사는 부산은행, BNK 투자증권, BNK 신용정보, BNK 캐피탈이 공동으로 주식의 포괄적 이전 방식에 의해 설립한 지방은행 최초의 금융지주회사임. 경남은행의 계열사 편입으로 부산/경남은행 두 은행 체제가 되었음. GS 자산운용(BNK 자산운용사 명 변경)을 자회사로 편입하여 은행, 증권, 자산운용, 여신전문, 저축은행업 등을 포괄하는 종합금융그룹이 되었음. BNK 벤처투자 자회사 편입.","['동사', '부산은행', '투자', '증권', '신용정보', '피탈', '공동', '주식', '포괄', '이전', '방식', '설립', '지방은행', '최초', '금융', '지주회사', '년', '경남은행', '계열사', '편입', '부산', '경남은행', '은행', '체제', '자산운용', '자산운용', '사명', '변경', '자회사', '편입', '은행', '증권', '자산운용', '여신', '전문', '저축', '은행업', '포괄', '종합', '금융', '그룹', '11월', '벤처', '투자', '자회사', '편입']",동사 부산은행 투자 증권 신용정보 피탈 공동 주식 포괄 이전 방식 설립 지방은행 최초 금융 지주회사 년 경남은행 계열사 편입 부산 경남은행 은행 체제 자산운용 자산운용 사명 변경 자회사 편입 은행 증권 자산운용 여신 전문 저축 은행업 포괄 종합 금융 그룹 11월 벤처 투자 자회사 편입 ,금융업,상업은행,사업 개요 BNK 금융 그 룹 설립 대한민국 최초 지방 은행 금융 지주 회사 경남은행 인수 자회사 편입 BNK 금융 지주 사명 변경 지금 당사 기준 국내 점포 해외 거점 네트워크 기반 글로벌 금융 그룹 성장 지역 유망 스타트업 발굴 모험 자본 공급자 역할 수행 그룹 신성 장동력 마련 편입 BNK 벤처 투자 포함 계열사 체계 완성 은행업 여신 전문 금융업 금융 투자업 저축 은행업 창업 투자업 신용 조사 추심 대행업 시스템 공급 개발업 금융업 전반 사업 영역 확장 국내 최고 지역 금 융 그룹 종합 금융 그룹 자리매김 은행 부문 경쟁력 제고 이자 은행 부문 수익 이익 창출력 확대 그룹 펀더멘털 강화 노력 지속 영업 종류 BNK 금융 지주 경영 비전 전략 경영 비전 지방 은행 최초 금융 지주 회사 출범 BNK 금융 그룹 지역 세계 고객 미래 경영 이념 바탕 대한민국 최고 지역 금융그룹 성장 도전 지속 결과 계열사 보유 종합 금융 그룹 면모 BNK 금융 그 룹 올해 경영 방침 핵심 경쟁력 강화 DIGITAL 혁신 지속 가능 경영 체계 구축 저금리 장기 디지털 전환 가속 그룹 수익 기반 약화 초래 우 호 경영 환경 대응 미래 지속 가능 성장 핵심 역량 제고 수익 강화 계획 전략 과제 BNK 금융 그룹 전략 과제 구분 내용 경영방침 전략 제①수익 중심 자산 성장 핵심 이익 개선 이자 은행 부문 성 창출력 강화 경상 수익력 제고②전략 비용 절감 경영 효율 극대 화③그룹 핵심 사업 영역 균형 성장 추구 DIGITAL TRANSFORMATION 그룹 디지털 경쟁력 제고⑤ ESG 환경 사회 지배 구조 경영 고도 화 ⑥금융 소비자 보호 강화 정도 경영 확립 BNK 금융 그룹 중장기 전략 과제 GROW 구분 내용 전략 목표 GROW ① G GREAT FINANCIAL GROUP ROE 이상 ② R RACE FOR GLOBAL 글로벌 당기 순이익 달성 O OPTIMIZED DIGITAL EXPERIENCE DIGITAL ON DEMAND 고객 중심 디지털 최적화 ④ W WELL BALANCED PORTFOLIO 은 행 당기 순이익 달성 전략 과제 GROW 달성 ①그 룹 근간 은행 경쟁력 제고 성장 수익 비 은 행 사업 부문 강화 성장 동력 WM 강화④ 자본시장부문 강화 CIB 기반 확장 ⑤ DIGITAL 관점 TRANSFORMATION ⑥장기 관점 GLOBALIZATION CASH COW 역할 자회사 안정 그룹 임직원 위기 상황 긴장감 업무 태세 위기 변화 선제 대비 GROW 달성 성공 걸음 의지 반영 올해 경영 화두 변즉통구 임직원 모두 급변 금융 환경 변화 미래 개척 나 BNK 금융 그룹 년 기업 마음가짐 BNK 금융 그룹 전략 과제 이행 계획 동사 부산은행 투자 증권 신용정보 피탈 공동 주식 포괄 이전 방식 설립 지방은행 최초 금융 지주회사 년 경남은행 계열사 편입 부산 경남은행 은행 체제 자산운용 자산운용 사명 변경 자회사 편입 은행 증권 자산운용 여신 전문 저축 은행업 포괄 종합 금융 그룹 11월 벤처 투자 자회사 편입 ,10
104,만도,204320,"동사는 2014년 한라홀딩스의 자동차부품 제조ㆍ판매업 부문이 인적분할되어 설립되었으며, 2014년 한국거래소 유가증권시장에 주식을 상장함.","동사는 자동차 제동장치, 조향장치, 현가장치 등을 생산하는 자동차 샤시부품 전문 제조회사임.","주요 매출처는 현대자동차, 기아자동차 및 현대모비스, 현대위아이며 이에 대한 매출액은 2020년 기준, 약 58%를 차지하며, 북미거점 OEM에서 20%의 비중을 차지함.","동사는 2014년 한라홀딩스의 자동차부품 제조ㆍ판매업 부문이 인적분할되어 설립되었으며, 2014년 한국거래소 유가증권시장에 주식을 상장함. 동사는 자동차 제동장치, 조향장치, 현가장치 등을 생산하는 자동차 샤시부품 전문 제조회사임. 주요 매출처는 현대자동차, 기아자동차 및 현대모비스, 현대위아이며 이에 대한 매출액은 2020년 기준, 약 58%를 차지하며, 북미거점 OEM에서 20%의 비중을 차지함.","동사는 한라홀딩스의 자동차 부품 제조 ㆍ 판매업 부문이 인적분할되어 설립되었으며, 한국거래소 유가증권시장에 주식을 상장함.동사는 자동차 제동장치, 조향장치, 현가장치 등을 생산하는 자동차 샤시 부품 전문제조회사임. 주요 매출처는 현대자동차, 기아자동차 및 현대모비스, 현대위 아이며 이에 대한 매출액은 기준, 약차지하며, 북미 거점 OEM에서 비중을 차지함.","['동사', '한라홀딩스', '자동차', '부품', '제조', '판매업', '부문', '인적', '분할', '설립', '한국거래소', '유가증권', '시장', '주식', '상장', '동사', '자동차', '제동', '장치', '향', '장치', '현가장치', '생산', '자동차', '샤시', '부품', '전문', '조회', '사임', '매출', '현대자동차', '기아자동차', '현대모비스', '현대위아', '매출액', '기준', '차지', '북미', '거점', '비중', '차지']",동사 한라홀딩스 자동차 부품 제조 판매업 부문 인적 분할 설립 한국거래소 유가증권 시장 주식 상장 동사 자동차 제동 장치 향 장치 현가장치 생산 자동차 샤시 부품 전문 조회 사임 매출 현대자동차 기아자동차 현대모비스 현대위아 매출액 기준 차지 북미 거점 비중 차지 ,운수장비,자동차부품,당사 제동 조향 현 가 ADAS 첨단 운전자 보조 시스템 운전자 안전 관련 제품 제조 기술 보유 자동차 부품 업체 평 택 원주 익 산 생산 사이트 판교 R D 센터 국내 매출 기록 성장세 COVID 영향 완성차 판매 감소 영향 국내 매출 기록 만도 사업 구조 안정 현대 기아차 GM FORD 중국 로컬 OEM 유럽 인도 완성차 고객 다 변화 진행 해외 고객 현지 대응 미국 유럽 중국 인도 지역 생산 사이트 설립 해외 연구소 설립 해외 고객 연구 개발 지원 현지특화 기술 개발 노력 경주 섀시 부품 기술 측면 국내 부품 업 최초 ABS ESC EPS ECS 첨단 전장 제품 개발 양산 미래 자율 주행차 적용 ADAS 제품 개발 분야 해외 선진 업체 경쟁 최근 미국 중국 기반 전기차 업체 차세대 제품 수주 경쟁력 증명 미래 먹거리 사업 발굴 최근 기술 전담 조직 WG 캠퍼스 설립 자동차 업계 변화 트렌드 CASE 연결 자동 차량 공유 전기차 대응 당사 지배 회사 연결 대상 종속 회사 포함 회사 영위 사업 이번 분기 I 회사 개요 주요 사업 내용 향후 추진 신규 사업 동사 한라홀딩스 자동차 부품 제조 판매업 부문 인적 분할 설립 한국거래소 유가증권 시장 주식 상장 동사 자동차 제동 장치 향 장치 현가장치 생산 자동차 샤시 부품 전문 조회 사임 매출 현대자동차 기아자동차 현대모비스 현대위아 매출액 기준 차지 북미 거점 비중 차지 ,6
105,롯데쇼핑,23530,지배회사인 동사는 1970년 7월 2일 백화점 경영을 목적으로 설립되었으며 2020년 2분기말기준 총 44개의 종속회사가 있음.,"사업부문은 경영의 다각화 실태를 적절히 반영할 수 있도록 백화점 사업부문, 할인점 사업부문, 전자제품전문점 사업부문, 슈퍼 사업부문, 홈쇼핑 사업부문, 기타 사업부문으로 세분화 됨.","2021년 반기 기준은 백화점 부문 18.0%, 할인점 부문 37.3%이며, 전자제품 전문점 부문 25.0%를 차지함.","지배회사인 동사는 1970년 7월 2일 백화점 경영을 목적으로 설립되었으며 2020년 2분기말기준 총 44개의 종속회사가 있음. 사업부문은 경영의 다각화 실태를 적절히 반영할 수 있도록 백화점 사업부문, 할인점 사업부문, 전자제품전문점 사업부문, 슈퍼 사업부문, 홈쇼핑 사업부문, 기타 사업부문으로 세분화 됨. 2021년 반기 기준은 백화점 부문 18.0%, 할인점 부문 37.3%이며, 전자제품 전문점 부문 25.0%를 차지함.","지배회사인 동사는 백화점 경영을 목적으로 설립되었으며 총종속회사가 있음.사업부문은 경영의 다각화 실태를 적절히 반영할 수 있도록 백화점 사업부문, 할인점 사업부문, 전자제품 전문점 사업부문, 슈퍼사업부문, 홈쇼핑 사업부문, 기타사업부문으로 세분화됨.반기 기준은 백화점 부문 할인점 부문 전자제품 전문점 부문 차지함.","['지배', '회사', '동사', '7월 2일', '백화점', '경영', '목적', '설립', '분기', '기준', '종속', '회사', '사업', '부문', '경영', '다각', '실태', '반영', '백화점', '사업', '부문', '할인점', '사업', '부문', '전자제품', '전문점', '사업', '부문', '슈퍼', '사업', '부문', '홈쇼핑', '사업', '부문', '기타', '사업', '부문', '분화', '반기', '기준', '백화점', '부문', '할인점', '부문', '전자제품', '전문점', '부문', '차지']",지배 회사 동사 7월 2일 백화점 경영 목적 설립 분기 기준 종속 회사 사업 부문 경영 다각 실태 반영 백화점 사업 부문 할인점 사업 부문 전자제품 전문점 사업 부문 슈퍼 사업 부문 홈쇼핑 사업 부문 기타 사업 부문 분화 반기 기준 백화점 부문 할인점 부문 전자제품 전문점 부문 차지 ,유통업,도소매,사업 개요 지배 회사 롯데 쇼핑 이하 당사 백화점 경영 목적 설립 종속 회사 당사 당사 종속 기업 이하 연결 실체 수익 창출 재화 용역 성격 시장 판매 방법 특징 사업 부문 구분 계속 고려 경영 다각 실태 반영 백화점 사업 부문 할인점 사업 부문 전자 제품 전문점 사업 부문 슈퍼 사업 부문 홈 쇼핑 사업 부문 영화 상영업 사업 부문 이커머스 사업 부문 기타 사업 부문 분 백화점 사업 부문 롯데 쇼핑 백화점 해외 백화점 별도법인 할인점 사업 부문 롯데 쇼핑 할인점 해외 할인점 별도법인 전자 제품 전문점 롯데 하이마트 슈퍼 사업 부문 롯데 쇼핑 슈퍼 씨 에스유 통 홈 쇼핑 사업 부문 홈쇼핑 영화 상영업 사업 부문 롯데 컬처웍스 이커머스 사업 부문 롯데 쇼핑 이커머스 기타 사업 부문 롯데 위탁 관리 부동산투자 회사 구성 매출 백화점 부문 전체 매출액 할인점 부문 전자 제품 전문점 부문 차지 슈퍼 부문 전체 이 홈 쇼핑 부문 전체 이 영화 상영업 부문 전체 이커머스 부문 전체 기타 부문 전체 차지 백화점 롯데 쇼핑 주식회사 소유 백화점 해외 경영 관리 계약 수탁 운영 영등 포 점 대 구점 아울렛 쇼핑몰 피트인 위수탁 운영점 포함 영업 해외 중국 베트남 인도네시아 해외 점포 운영 할인점 HYPERMARKET 위수탁 운영점 포 서울역점 인천터 미널점 포함 VIC MARKET 운영 디지털 풀필먼트 시스템 구축 오프 통합 미래형 매장 스마트 스토어 SMARTSTORE 운영 매장 후방 패킹 자동화설비 장착 권역 배송 CAPA 향상 형태 세미다크스토어 운영 해외 인도네시아 베트남 해외 점포 운영 전자 제품 전문점 신속 출점 단기간 전국 점포망 전자 제품 전문점 입지 구축 점포 물류 센터 운영 슈퍼 사업 부문 롯데 쇼핑 슈퍼 사업부 슈퍼 직영 가맹 슈퍼 마켓 직영 가맹 운영 씨 에 스유통 직영 운영 영화 상영업 사업 부문 국내 해외 베트남 중국 운영 홈 쇼핑 사업 부문 TV 홈 쇼핑 인터넷 쇼핑 ONE TV 사업 카탈로그 사업 영위 이커머스 사업 부문 그룹 온라인 쇼핑몰 로그인 자유 이동 롯데 ON 오픈 운영 사업 부문 주요 사업 내용 다음 인도네시아 시장 할인점 사업 LOTTE PROPERTIES CHENGDU HK LIMITED 중국 청두 반 성강 프로젝트 복합 개발 사업 투자 LOTTE PROPERTIES CHENGDU LIMITED 중국 청두 반 성강 프로젝트 복합 개발 사업 롯데 개발 사업롯 데 몰 하노 이 프로젝트 복합 개발 사업 투자 LOTTE PROPERTIES HANOI CO LTD 롯 데 D 롯데몰 하노 이 프로젝트 복합 개발 사업 연결실체 사업 부문 요약 재무 현황 다음 기타 연결 조정 금액 포함 공통 자산 비용 배부 기준 공통 자산 비용 사업 부문 귀속 경우 귀속 귀속 여부 분 경우 별도 배부 기준 매출액 비율 인건비 비율 적용 사업 부문 부 지배 회사 동사 7월 2일 백화점 경영 목적 설립 분기 기준 종속 회사 사업 부문 경영 다각 실태 반영 백화점 사업 부문 할인점 사업 부문 전자제품 전문점 사업 부문 슈퍼 사업 부문 홈쇼핑 사업 부문 기타 사업 부문 분화 반기 기준 백화점 부문 할인점 부문 전자제품 전문점 부문 차지 ,9
106,씨에스윈드,112610,"2006년 설립되었으며 풍력발전 설비 및 제조, 관련 기술 개발, 강구조물 제작 및 설치, 풍력발전 관련 컨설팅 및 지원서비스 사업을 영위.",최근 해상풍력을 주력으로 시장경쟁력을 강화하기 위하여 해상풍력타워 하부구조물 사업도 새롭게 진출을 준비중임.,"동사는 미국, 유럽, 호주 시장의 폭발적인 풍력 타워 수요에 대응하기 위해 과감한 설비투자 및 인력채용을 통해 생산능력을 대폭 증가시킴.","2006년 설립되었으며 풍력발전 설비 및 제조, 관련 기술 개발, 강구조물 제작 및 설치, 풍력발전 관련 컨설팅 및 지원서비스 사업을 영위. 최근 해상풍력을 주력으로 시장경쟁력을 강화하기 위하여 해상풍력타워 하부구조물 사업도 새롭게 진출을 준비중임. 동사는 미국, 유럽, 호주 시장의 폭발적인 풍력 타워 수요에 대응하기 위해 과감한 설비투자 및 인력채용을 통해 생산능력을 대폭 증가시킴.","설립되었으며 풍력발전설비 및 제조, 관련 기술 개발, 강구조물 제작 및 설치, 풍력발전 관련 컨설팅 및 지원서비스 사업을 영위.최근 해상풍력을 주력으로 시장 경쟁력을 강화하기 위하여 해상풍력타워 하부 구조물 사업도 새롭게 진출을 준비 중임.동사는 미국, 유럽, 호주 시장의 폭발적인 풍력타워 수요에 대응하기 위해 과감한 설비투자 및 인력채용을 통해 생산능력을 대폭 증가시킴.","['설립', '풍력', '발전', '설비', '제조', '관련', '기술', '개발', '구조물', '제작', '설치', '풍력', '발전', '관련', '컨설팅', '지원', '서비스', '사업', '영위', '최근', '해상', '풍력', '주력', '시장', '경쟁력', '강화', '해상', '풍력', '타워', '하부', '구조물', '사업', '진출', '준비', '중임', '동사', '미국', '유럽', '호주', '시장', '폭발', '풍력', '타워', '수요', '대응', '설비', '투자', '인력', '채용', '생산', '능력', '증가']",설립 풍력 발전 설비 제조 관련 기술 개발 구조물 제작 설치 풍력 발전 관련 컨설팅 지원 서비스 사업 영위 최근 해상 풍력 주력 시장 경쟁력 강화 해상 풍력 타워 하부 구조물 사업 진출 준비 중임 동사 미국 유럽 호주 시장 폭발 풍력 타워 수요 대응 설비 투자 인력 채용 생산 능력 증가 ,기계,에너지 시설 및 서비스,당사 결 종속 회사 풍 생산 타워 내 부 부품 베어링 생산 풍력 타 부품 생산 사업 운영 당사 한국 본사 기반 작성 기준일 현재 베트남 말레이시아 중국 터키 대만 인도네시아 해외 타워 생산법인 운영 풍력 발전 타워 설치 지역 육상 해상 현지 기후 특성 고객 주문 다품종 소량 생산 기반 공급 지역 유럽 미국 아시아 세계 시장 납품 최근 해상 풍력 주력 시장 경쟁력 강화 해상 풍력타 하부 구조물 사업 진출 설립 풍력 발전 설비 제조 관련 기술 개발 구조물 제작 설치 풍력 발전 관련 컨설팅 지원 서비스 사업 영위 최근 해상 풍력 주력 시장 경쟁력 강화 해상 풍력 타워 하부 구조물 사업 진출 준비 중임 동사 미국 유럽 호주 시장 폭발 풍력 타워 수요 대응 설비 투자 인력 채용 생산 능력 증가 ,6
