,name,code,x1,x2,x3,x,x_nonumber,morph,morph_sum,labels_kse,labels_fics,morph_sumdart,cluster
0,삼성전자,5930,"한국 및 CE, IM부문 해외 9개 지역총괄과 DS부문 해외 5개 지역총괄, Harman 등 237개의 종속기업으로 구성된 글로벌 전자기업임.","세트사업에는 TV, 냉장고 등을 생산하는 CE부문과 스마트폰, 네트워크시스템, 컴퓨터 등을 생산하는 IM부문이 있음.","부품사업(DS부문)에서는 D램, 낸드 플래쉬, 모바일AP 등의 제품을 생산하는 반도체 사업과 TFT-LCD 및 OLED 디스플레이 패널을 생산하는 DP사업으로 구성됨.","한국 및 CE, IM부문 해외 9개 지역총괄과 DS부문 해외 5개 지역총괄, Harman 등 237개의 종속기업으로 구성된 글로벌 전자기업임. 세트사업에는 TV, 냉장고 등을 생산하는 CE부문과 스마트폰, 네트워크시스템, 컴퓨터 등을 생산하는 IM부문이 있음. 부품사업(DS부문)에서는 D램, 낸드 플래쉬, 모바일AP 등의 제품을 생산하는 반도체 사업과 TFT-LCD 및 OLED 디스플레이 패널을 생산하는 DP사업으로 구성됨.","한국 및 CE, IM 부문 해외지역 총괄과 DS 부문 해외지역 총괄, Harman 등 종속기업으로 구성된 글로벌 전자기업임.세트사업에는 TV, 냉장고 등을 생산하는 CE 부문과 스마트폰, 네트워크 시스템, 컴퓨터 등을 생산하는 IM부문이 있음.부품 사업(DS부문)에서는 D램, 낸드플래쉬, 모바일 AP 등의 제품을 생산하는 반도체 사업과 TFT-LCD 및 OLED 디스플레이 패널을 생산하는 DP사업으로 구성됨.","['한국', '부문', '해외', '지역', '총괄', '부문', '해외', '지역', '총괄', '개', '종속', '기업', '구성', '글로벌', '전자', '기업', '세트', '사업', '냉장고', '생산', '부문', '스마트폰', '네트워크', '시스템', '컴퓨터', '생산', '부문', '부품', '사업', '부문', '드', '플래쉬', '모바일', 'AP', '제품', '생산', '반도체', '사업', '디스플레이', '패널', '생산', '사업', '구성']",한국 부문 해외 지역 총괄 부문 해외 지역 총괄 개 종속 기업 구성 글로벌 전자 기업 세트 사업 냉장고 생산 부문 스마트폰 네트워크 시스템 컴퓨터 생산 부문 부품 사업 부문 드 플래쉬 모바일 AP 제품 생산 반도체 사업 디스플레이 패널 생산 사업 구성 ,"전기,전자",휴대폰 및 관련부품,당사 본사 거점 한국 과 CE IM 부문 산하 해외 지역 총괄 DS 부문 산하 해외 지역 총괄 생산 판매 법인 HARMAN 부문 산하 종속 기업 종속 기업 구성 글로벌 전자 기업 사업 SET 사업 TV 모니터 냉장고 세탁기 에어컨 생산 판매 CE CONSUMER ELECTRONICS 부문 HHP 스마트폰 네트워크 시스템 컴퓨터 생산 판매 IM INFORMATION TECHNOLOGY MOBILE COMMUNICATIONS 부문 부품 사업 DRAM NAND FLASH 모바일 AP 제품 생산 판매 반도체 사업 스마트폰 OLED TV 모니터 LCD 디스플레이 패널 생산 판매 DP 사업 구성 DS DEVICE SOLUTIONS 부문 인수 HARMAN 부문 디지털 DIGITAL COCKPIT 텔레매틱스 TELEMATICS 스피커 생산 판매 부문 사업 사항 기타 참고 사항 사업 부문 현황 사업 부문 요약 재무 현황 항목 참조 지역 국내 지역 CE IM 부문 반도체 사업 총괄 본사 종속 기업 사업 운영 본사 수원 구 미 광주 기흥 화 성 평택 사업장 구성 국내 종속 기업 디스플레이 패널 생산 삼성 디스플레이 국내 대리점 판매 전담 삼성 전자 판매 제품 서비스 담당 삼성 전자 서비스 제품 운송 담당 삼성 전자로지텍 상장 종속 기업 구성 해외 지역 미주 유럽 CIS 중동 아프리카 아시아 등 생산 판매 연구 활동 담당 상장 종속 기업 운영 미주 TV HHP SET 제품 미국 판매 담당 SEA NEW JERSEY USA TV 생산 담당 SII CALIFORNIA USA 반도체 DP 판매 담당 SSI CALIFORNIA USA 반도체 생산 담당 SAS TEXAS USA SET 제품 복합 생산 법 SEDA BRAZIL 전장 부품 사업 담당 HARMAN CONNECTICUT USA 포함 판매 생산 담당 법인 유럽 CIS SEUK UK SEG GERMANY SEF FRANCE SEI ITALY SET 제품 판매법인 SEH HUNGARY SESK SK SLOVAKIA TV 생산 법인 가전 제품 생산 법 SEPM POLAND 포함 법인 운영 중동 아프리카 SGE UAE SSA SOUTH AFRICA SET 제품 판매법인 SEEG EGYPT SSAP SOUTH AFRICA TV 생산 법인 포함 법인 운영 아시아 중국 제외 에 SESP SINGAPORE SEAU AUSTRALIA SEPCO PHILIPPINES SME MALAYSIA 판매법인 HHP 생산 법 SEV SEVT VIETNAM TV 생산 법 SEHC VIETNAM DP 생산 법 SDV VIETNAM 복합 생산 법 SIEL INDIA 포함 법인 운영 중국 SCIC BEIJING SEHK HONG KONG SET 제품 판매법인 SSS SHANGHAI SSCX XIAN 반도체 DP 판매 법인 SSEC SUZHOU SET 제품 생산 법인 SCS XIAN 반도체 생산 법인 포함 법인 운영 종속 기업 사항 XII 상세표 연결 대상 종속 회사 현황 상세 항목 참조 반기 당사 매출 전년 동기 대비 증가 주요 매출처 APPLE AVP ELECTRONICS BEST BUY DEUTSCHE TELEKOM VERIZON 알파벳순 한국 부문 해외 지역 총괄 부문 해외 지역 총괄 개 종속 기업 구성 글로벌 전자 기업 세트 사업 냉장고 생산 부문 스마트폰 네트워크 시스템 컴퓨터 생산 부문 부품 사업 부문 드 플래쉬 모바일 AP 제품 생산 반도체 사업 디스플레이 패널 생산 사업 구성 ,6
1,SK하이닉스,660,"1983년 현대전자로 설립됐고, 2001년 하이닉스반도체를 거쳐 2012년 최대주주가 SK텔레콤으로 바뀌면서 SK하이닉스로 상호를 변경함.","주력 생산제품은 DRAM, 낸드플래쉬, MCP와 같은 메모리 반도체이며, 2007년부터 시스템LSI 분야인 CIS 사업에 재진출함.","2020년 10월 인텔의 NAND사업  양수를 결정함. 세계 반도체시장 점유율은 D램 28.1%, 낸드플래시 12.7%임.","1983년 현대전자로 설립됐고, 2001년 하이닉스반도체를 거쳐 2012년 최대주주가 SK텔레콤으로 바뀌면서 SK하이닉스로 상호를 변경함. 주력 생산제품은 DRAM, 낸드플래쉬, MCP와 같은 메모리 반도체이며, 2007년부터 시스템LSI 분야인 CIS 사업에 재진출함. 2020년 10월 인텔의 NAND사업  양수를 결정함. 세계 반도체시장 점유율은 D램 28.1%, 낸드플래시 12.7%임.","현대전자로 설립됐고, 하이닉스반도체를 거쳐 최대주주가 SK 텔레콤으로 바뀌면서 SK 하이닉스로 상호를 변경함. 주력 생산제품은 DRAM, 낸드플래쉬, MCP와 같은 메모리 반도체이며, 시스템 LSI 분야인 CIS 사업에 재진출함.인텔의 NAND 사업 양수를 결정함.세계 반도체 시장 점유율은 D램 낸드플래시","['현대전자', '설립', '하이', '닉스', '반도체', '최', '대주주', 'SK텔레콤', 'SK하이닉스', '상호', '변경', '주력', '생산', '제품', '플래쉬', '메모리', '반도체', '시스템', '분야', '사업', '진출', '10월', '인텔', '사업', '양수', '결정', '세계', '반도체', '시장 점유율', '드', '플래시']",현대전자 설립 하이 닉스 반도체 최 대주주 SK텔레콤 SK하이닉스 상호 변경 주력 생산 제품 플래쉬 메모리 반도체 시스템 분야 사업 진출 10월 인텔 사업 양수 결정 세계 반도체 시장 점유율 드 플래시 ,"전기,전자",반도체 및 관련장비,당사 현대 전자 산업 주식 회사 사명 변경 이후 주식회사 LG 반도체 합병 반도체 메모리반 도체 사업 기반 성장 SK 그룹 편입 현재 미국 독일 영국 일본 싱가포르 인도 홍콩 대만 중국 판매법 사무소 설치 글로벌 영업망 구축 당사 당사 종속 기업 주력 제품 DRAM NAND 중심 메모리반도체 주력 생산 시설 일부 FAB M M 일부 활용 시스템 반도체 CIS CMOS IMAGE SENSOR 생산 파운드리 FOUNDRY 사업 병행 반도체 메모리 반도체 메모리 반도체 구분 메모리 반도체 정보 저장 기억 기능 일반 휘발 VOLATILE 비휘발 NON VOLATILE 분류 휘발 메모리 제품 전원 정보 반면 비휘발성 제품 전원 저장 정보 당사 휘발 메모리 DRAM 비휘 발성 메모리 NAND FLASH 주력 생산 당사 생산 시설 국내 중국 소재 국내 소재 FAB DRAM 생산 M M M 천 과 NAND 생산 M M M 청주 M M 준공 완료 최신 FAB DRAM 주력 생산 예정 M DRAM NAND 혼용 생산 M DRAM CIS 혼용 생산 중국 소재 FAB DRAM 생산 C C 중국 장쑤 우시 당사 매출액 반기 누계 기록 내용 공시 서류 II 사업 내용 참조 현대전자 설립 하이 닉스 반도체 최 대주주 SK텔레콤 SK하이닉스 상호 변경 주력 생산 제품 플래쉬 메모리 반도체 시스템 분야 사업 진출 10월 인텔 사업 양수 결정 세계 반도체 시장 점유율 드 플래시 ,11
2,NAVER,35420,"동사는 국내 1위 포털 서비스를 기반으로 광고, 쇼핑, 디지털 간편결제 사업을 영위하고 있으며, 공공/금융 분야를 중심으로 클라우드를 비롯한 다양한 IT 인프라 및 기업향 솔루션 제공을 확대해가고 있음.","웹툰, Zepeto, V LIVE 등 다양한 콘텐츠 사업을 통해서도 글로벌 사업 기반을 확장하고 있는 ICT 기업임.","네이버파이낸셜, 네이버 클라우드 등 연결대상 종속회사 76개를 보유함.","동사는 국내 1위 포털 서비스를 기반으로 광고, 쇼핑, 디지털 간편결제 사업을 영위하고 있으며, 공공/금융 분야를 중심으로 클라우드를 비롯한 다양한 IT 인프라 및 기업향 솔루션 제공을 확대해가고 있음. 웹툰, Zepeto, V LIVE 등 다양한 콘텐츠 사업을 통해서도 글로벌 사업 기반을 확장하고 있는 ICT 기업임. 네이버파이낸셜, 네이버 클라우드 등 연결대상 종속회사 76개를 보유함.","동사는 국내 포털 서비스를 기반으로 광고, 쇼핑, 디지털 간편결제 사업을 영위하고 있으며, 공공/금융 분야를 중심으로 클라우드를 비롯한 다양한 IT 인프라 및 기업향 솔루션 제공을 확대해 가고 있음. 웹툰, Zepeto, VLIVE 등 다양한 콘텐츠 사업을 통해서도 글로벌 사업 기반을 확장하고 있는 ICT 기업임.네이버 파이낸셜, 네이버 클라우드 등 연결 대상 종속회사 보유함.","['동사', '국내', '포털', '서비스', '기반', '광고', '쇼핑', '디지털', '결제', '사업', '영위', '공공', '금융', '분야', '중심', '클라우드', '인프라', '기업', '솔루션', '제공', '확대', '웹툰', '콘텐츠', '사업', '글로벌', '사업', '기반', '확장', '기업', '네이버', '파이낸셜', '네이버 클라우드', '연결', '대상', '종속', '회사', '보유']",동사 국내 포털 서비스 기반 광고 쇼핑 디지털 결제 사업 영위 공공 금융 분야 중심 클라우드 인프라 기업 솔루션 제공 확대 웹툰 콘텐츠 사업 글로벌 사업 기반 확장 기업 네이버 파이낸셜 네이버 클라우드 연결 대상 종속 회사 보유 ,서비스업,인터넷 서비스,네이버 혁신 최고 서비스 글로벌 도전 집합체 A SET OF GLOBAL CHALLENGES 첨단 기술 일상 서비스 사용자 연결 경험 도전 다양 기회 가능 네이버 이해 관계자 차별 가치 제공 네이버 환경 변화 변화 도약 기회 동안 회사 성장 견인 혁신 바탕 글로벌 시장 신규 사업 도전 네이버 지속 성장 목표 기술 서비스 선제 투자 진행 핵심 사업 경쟁력 강화 네이버 국내 인터넷 검색 포털 네이버 NAVER 기반 광고 커머스 사업 매출 창출 웹툰 ZEPETO V LIVE 콘텐츠 서비스 금융 씬파 러 핀테크 기업 솔루션 제공 클라우드 다각 사업 포트폴리오 기반 안정 성장 네이버 기존 사업 성장세 유지 한편 신성 장동력 커머 스 핀테크 콘텐츠 클라우드 사업 모두 성장 사업 부문 매출 현황 사업 내용 매출 수주 상황 참고 동사 국내 포털 서비스 기반 광고 쇼핑 디지털 결제 사업 영위 공공 금융 분야 중심 클라우드 인프라 기업 솔루션 제공 확대 웹툰 콘텐츠 사업 글로벌 사업 기반 확장 기업 네이버 파이낸셜 네이버 클라우드 연결 대상 종속 회사 보유 ,1
3,삼성바이오로직스,207940,"삼성그룹의 계열사로 2011년 4월 설립되었으며, 국내외 제약회사의 첨단 바이오의약품을 위탁 생산하는 CMO 사업을 영위.","2018년 cGMP 생산을 시작하여 2019년말 기준 36.2만리터 생산설비를 가동 중이며, 이 시장에서 선발업체를 추월해 생산설비 기준 세계 1위 CMO로 도약.",동사의 바이오의약품 연구개발 자회사인 삼성바이오에피스와 아키젠바이오텍은 바이오시밀러 개발 및 상업화를 진행 중.,"삼성그룹의 계열사로 2011년 4월 설립되었으며, 국내외 제약회사의 첨단 바이오의약품을 위탁 생산하는 CMO 사업을 영위. 2018년 cGMP 생산을 시작하여 2019년말 기준 36.2만리터 생산설비를 가동 중이며, 이 시장에서 선발업체를 추월해 생산설비 기준 세계 1위 CMO로 도약. 동사의 바이오의약품 연구개발 자회사인 삼성바이오에피스와 아키젠바이오텍은 바이오시밀러 개발 및 상업화를 진행 중.","삼성 그룹의 계열사로 설립되었으며, 국내외 제약회사의 첨단 바이오의약품을 위탁 생산하는 CMO 사업을 영위. cGMP 생산을 시작하여 기준 생산설비를 가동 중이며, 이 시장에서 선발업체를 추월해 생산설비 기준 세계 CMO로 도약. 동사의 바이오의약품 연구개발 자회사인 삼성 바이오에피스와 아키젠바이오텍은 바이오시밀러 개발 및 상업화를 진행 중.","['삼성그룹', '계열사', '2011년 4월', '설립', '국내외', '제약', '회사', '첨단', '바이오', '의약품', '위탁', '생산', '사업', '영위', '생산', '시작', '2019년', '기준', '리터', '생산', '설비', '가동', '시장', '선발', '업체', '추월', '생산', '설비', '기준', '세계', '도약', '동사', '바이오', '의약품', '연구개발', '자회사', '삼성바이오에피스', '키젠', '이', '오텍', '바이오시밀러', '개발', '상업', '진행']",삼성그룹 계열사 2011년 4월 설립 국내외 제약 회사 첨단 바이오 의약품 위탁 생산 사업 영위 생산 시작 2019년 기준 리터 생산 설비 가동 시장 선발 업체 추월 생산 설비 기준 세계 도약 동사 바이오 의약품 연구개발 자회사 삼성바이오에피스 키젠 이 오텍 바이오시밀러 개발 상업 진행 ,의약품,바이오,당사 바이오 의약품 위탁 생산 CMO 사업 세포주개발 공정 제형 분석법 세포주 개발 초기 임상 개발 서비스 제공 CDO 사업 영위 당사 인천송도 경제 자유구역 송도 지구 상업 생산 설비 임상 생산 설비 CAPACITY 확보 생산 설비 기준 세계 바이오 CMO 부상 LONZA BOEHRINGER INGELHEIM CDO 사업 안정 수주 확대 해외 거점 확대 운영 미국에 종속 기업 SAMSUNG BIOLOGICS AMERICA INC . 설립 당사 바이오의약품 연구 개발 자회사 삼성 바이오 에피스 바이오 시밀러 개발 상업 진행 이오의약품 시장 규모 전체 제약 시장 비중 차지 연평균 성장 제약 시장 성장 견인 전망 성장 제약사 CMO 활용 확대 추세 EVALUATE PHARMA MCKINSEY 기준 바이오 CDMO 시장 규모 블록버스터 바이오 의약품 지속 개발 글로벌 제약사 중소 바 이오 텍 생산 분야 아웃소싱 확대 제약 사대 END TO END CDMO SERVICE 제공 니즈 증가 공급 안정 확보 DUAL SOURCING 수요 확보 성장 요인 기인 기준 향후 연평균 성장 기준 규모 성장 전망 FROST SULLIVAN 기준 당사 바이오 의약품 시장 주류 동물 세포 기반 항체 의약품 생산 전문 바이오 CMO 사업 영위 시장 당사 대형 생산 설비 보유 소수 대형 CMO 기업 시장 주도 기준 스위스에 본사 LONZA 세계 동물 세포 배양 설비 보유 독일 BOEHRINGER INGELHEIM 독일 미국 생산 설비 보유 경쟁사 미국 스위스 독일 주요 국가 생산 규모 증설 당사 규모 CGMP 생산 시작 기준 생산 설비 가동 향후 규모 신설 세계 생산 설비 리더십 지속유지 전망 당사 항체 의약품 CMO 중심 서비스 글로벌 종합 바이오기업 도약 사업 영역 CDO 서비스 확장중 코로 확산 이후 급증 시장 수요 MRNA 백신 원료 의약품 생산 역량 CDO 서비스 자체 세포주 공정 개발 역량 중소 제약사 대상 세포주 공정 제형 개발 서비스 제공 위탁 개발 서비스 당사 업계 평균 대비 배 향상 세포 생존력 개선 증식력 자체 개발 세포주 에스 초이 스 S CHOICE 개발 성공 미국 대표 바이오 클 러스터 샌프란시스코 의약품 위탁 개발 R D 센터 향후 보스턴 유럽 중국 순차 진출 계획 MRNA 백신 바이러스 직접 체내 주입 기존 백신 비교 안전 백신 때 바이러스 항원 배양 시간 시간 절약 장점 당사 인천 송도 기존 설비 증설 상반기 우수 의약품 제조 품질 관리 기준 CGMP 대한준 비 완비 삼성그룹 계열사 2011년 4월 설립 국내외 제약 회사 첨단 바이오 의약품 위탁 생산 사업 영위 생산 시작 2019년 기준 리터 생산 설비 가동 시장 선발 업체 추월 생산 설비 기준 세계 도약 동사 바이오 의약품 연구개발 자회사 삼성바이오에피스 키젠 이 오텍 바이오시밀러 개발 상업 진행 ,4
4,LG화학,51910,"동사는 석유화학 사업부문, 전지 사업부문, 첨단소재 사업부문, 생명과학 사업부문, 공통 및 기타부문의 사업을 영위하고 있음.",연결회사는 2020년 12월 1일 전지 사업부문을 단순·물적분할하여 (주)LG에너지솔루션 및 그 종속기업을 설립함.,"동사는 양극재, 엔지니어링 소재, IT소재의 경쟁력을 바탕으로 고부가 제품을 중심으로 한 포트폴리오 전환을 추진 중에 있음.","동사는 석유화학 사업부문, 전지 사업부문, 첨단소재 사업부문, 생명과학 사업부문, 공통 및 기타부문의 사업을 영위하고 있음. 연결회사는 2020년 12월 1일 전지 사업부문을 단순·물적분할하여 (주)LG에너지솔루션 및 그 종속기업을 설립함. 동사는 양극재, 엔지니어링 소재, IT소재의 경쟁력을 바탕으로 고부가 제품을 중심으로 한 포트폴리오 전환을 추진 중에 있음.","동사는 석유화학 사업부문, 전지사업부문, 첨단소재사업부문, 생명과학사업부문, 공통 및 기타 부문의 사업을 영위하고 있음.연결회사는 전지사업부문을 단순·물적분할하여㈜ LG 에너지솔루션 및 그 종속기업을 설립함.동사는 양극재, 엔지니어링 소재, IT소재의 경쟁력을 바탕으로 고부가 제품을 중심으로 한 포트폴리오 전환을 추진 중에 있음.","['동사', '석유화학', '사업', '부문', '전지', '사업', '부문', '첨단', '소재', '사업', '부문', '생명과학', '사업', '부문', '공통', '기타', '부문', '사업', '영위', '연결', '회사', '12월 1일', '전지', '사업', '부문', '물적', '분할', '에너지', '솔루션', '종속', '기업', '설립', '동사', '양극', '엔지니어링', '소재', '소재', '경쟁력', '바탕', '고부', '제품', '중심', '포트폴리오', '전환', '추진']",동사 석유화학 사업 부문 전지 사업 부문 첨단 소재 사업 부문 생명과학 사업 부문 공통 기타 부문 사업 영위 연결 회사 12월 1일 전지 사업 부문 물적 분할 에너지 솔루션 종속 기업 설립 동사 양극 엔지니어링 소재 소재 경쟁력 바탕 고부 제품 중심 포트폴리오 전환 추진 ,화학,화학,석유 화학 사업 납사 원료 에틸렌 프로필렌 부타디 벤젠 기초 유분 생산 공업 원료 다양 합성 수지 생산 공업 포괄 사업 규모 장치 산업 특징 주요 제품 PE PVC ABS SAP 합성 고무 첨단 소재 사업 IT 가전 산업 기술 변화 자동차 경량 전기차 자동차 산업 트렌드 핵심 소재 개발 생산 판매 사업 IT 가전 자동차 산업 기술 변화 기술 제품 개발 고객 맞춤 전략 추진 생명 과학사업 당뇨 신약 제미글 로 인간 성장 호르몬제 유 트로핀 관절 염주 사 시노비안 류머티스 관절염 치료제 유셉트 히알루론산 필러 이브아르 유 펜타 의약품 생산 판매 사업 전지 사업 EV ELECTRIC VEHICLE LEV LIGHT ELECTRIC VEHICLE ESS 에너지 저장 장치 IT 기기 전동공구 적용 전지 관련 제품 연구 개발 제조 판매 사업 당사 해당 사업 부문 단순 물 분할 종속 회사 LG 에너지솔루션 설립 EV 각국 환경 규제 친환경 정책 확대 수요 증가 성장 가능 사업 ESS 신재생 에너지 발전 발전 전력 효율 활용 중요 수요 확대 당사 종속 회사 팜한농 작물 보호 비료 종자 제조 판매 주요 사업 당사 매출액 작물 보호 사업 비료 사업 종자 사업 기타 로 구성 작물 보호 사업 친환경 독 제품 개발 비료 사업 특수 비료 중심 사업 구조 전환 종자 분야 다양 원예 종자 확보 신품종 개발 지속 추진 당사 반기 기준 매출 달성 사업 부문 매출액 석유 화학 전지 첨단 소재 생명 과학 공통 기타 부문 로 구성 석유 화학 사업 부문 글로벌 경기 회복 전방 산업 수요 개선 신재생 너지 위생 소재 포함 친환경 제품 차별 제품 포트폴리오 보유 주요 제품 ABS PVC NBL 매출 확대 역대 최고 실적 달성 상반기 과열 수요 진정 스 프 레드 하향 안정 예상 여 수 NCC CNT 중국 NBL 신규 증설 라인 본격 가동 매출 확대 DOWNSTREAM 중심 차별 제품 포트폴리오 바탕 견조 수익 지속 유지 예상 전지 사업 부문 반도체 수급 이슈 고객사 생산량 감소 ESS 충당금 설정 전기 차용 원통 전지 매출 증가 소송 합의 라 이선스비 인식 전분기 대비 매출 수익 개선 향후 반도체 수급 이슈 개선 고객사 생산 정상 기대 하반기 프리미엄 IT 제품 출시 본격 예상 첨단 소재 사업 부문 양극재 출하량 확대 엔지니어링 소재 판가 상승 전년 대비 매출 성장 생산 향상 활동 수익 개선 향후 단기 전방 산업 수급 기존 양극재 사업 금번 인수 결정 SRS 분리막 사업 작성 기준일 이후 당사 이사회 승인 특수 관계인 영 업 양수 공시 지 소재 사업 확대 지속 매출 성장 견조 수익 확보 예상 생명 과학 사업 부문 당뇨 치료제 제 미글로 성장 호르몬제 유 트 로핀 주요 제품 시장 지위 강화 동시 제품 소아마비 백신 유폴리 오 공급 개시 매출 성장 수익 개선 향후 주요 제품 시장 점유 유지 에스테틱 분야 수요 회복 예상 글로벌 신약 개발 강화 R D 투자 확대 전망 주 팜 한 농 사업 원료 상승 불구 작물 보호 판매 확대 전년 대비 매출 수익 개선 테라도 미국 호주 출시 해외 사업 기반 강화 향후 작물 보호제 종자 판매 확대 수익 구조 개선 전망 동사 석유화학 사업 부문 전지 사업 부문 첨단 소재 사업 부문 생명과학 사업 부문 공통 기타 부문 사업 영위 연결 회사 12월 1일 전지 사업 부문 물적 분할 에너지 솔루션 종속 기업 설립 동사 양극 엔지니어링 소재 소재 경쟁력 바탕 고부 제품 중심 포트폴리오 전환 추진 ,6
