,name,code,x1,x2,x3,x,x_nonumber,morph,morph_sum,labels_kse,labels_fics,morph_sumdart,cluster
51,LG유플러스,32640,"동사는 LG그룹 계열사로 무선, 스마트홈, 기업서비스 시장의 통신 사업을 영위함. 엘지헬리보진, 아인텔레서비스, 미디어로그 등을 연결대상 종속회사로 보유함.","2021년 2분기 별도 기준 서비스수익 중 무선서비스 비중은 57.7%, 스마트홈 22.0%, 기업인프라 15.9%, 전화 서비스 수익은 4.4%임.","2021년 2분기 말 기준 시장 점유율은 무선서비스 24%, 초고속인터넷 20.5%, IPTV 25.7% 등임.","동사는 LG그룹 계열사로 무선, 스마트홈, 기업서비스 시장의 통신 사업을 영위함. 엘지헬리보진, 아인텔레서비스, 미디어로그 등을 연결대상 종속회사로 보유함. 2021년 2분기 별도 기준 서비스수익 중 무선서비스 비중은 57.7%, 스마트홈 22.0%, 기업인프라 15.9%, 전화 서비스 수익은 4.4%임. 2021년 2분기 말 기준 시장 점유율은 무선서비스 24%, 초고속인터넷 20.5%, IPTV 25.7% 등임.","동사는 LG 그룹 계열사로 무선, 스마트홈, 기업 서비스 시장의 통신사업을 영위함 .엘지헬리보진, 아인텔레 서비스, 미디어로그 등을 연결 대상 종속회사로 보유함 .별도 기준 서비스 수익 중 무선서비스 비중은 스마트홈 기업인프라 전화 서비스 수익은 말기준 시장 점유율은 무선서비스 초고속인터넷 IPTV 등임.","['동사', 'LG그룹', '계열사', '무선', '스마트', '기업', '서비스', '시장', '통신', '사업', '영위', '엘지', '헬리', '보지', '아인텔레서비스', '미디어', '로그', '연결', '대상', '종속', '회사', '보유', '분기', '별도', '기준', '서비스', '수익', '무선', '서비스', '비중', '스마트', '기업', '인프라', '전화', '서비스', '수익', '년', '분기', '기준', '시장 점유율', '무선', '서비스', '초고', '인터넷']",동사 LG그룹 계열사 무선 스마트 기업 서비스 시장 통신 사업 영위 엘지 헬리 보지 아인텔레서비스 미디어 로그 연결 대상 종속 회사 보유 분기 별도 기준 서비스 수익 무선 서비스 비중 스마트 기업 인프라 전화 서비스 수익 년 분기 기준 시장 점유율 무선 서비스 초고 인터넷 ,통신업,무선통신,LG 유플러스 모바일 스 마 트홈 서비스 제공 컨 슈머 사업 기업인프라 사업 영위 산업 혁명 포스트코로 시대 다양 콘텐츠 고객맞춤 제공 디지털뉴딜 정책 기술 기반 발전 스마트 팩토리 스마트모빌리티 B 사업 미래 성장 동력 발전 LG 유플러스 반기 연결 기준 서비스 수익 단 수익 영업 수익 기록 연결 기준 서비스 수익 전년 동기 대비 성장 기록 별도기준 전년 대비 성장 기록 동분기 LG 유플러스 별도 기준 서비스 수익 무선 서비스 비중 스마 트홈 기업인프 전화 서비스 수익 LG 유플러스 주요 종속 회사 LG 헬로비전 설립 LG 유플러스 지분 취득 지배력 획득 케이블 TV 고속인터넷 인터넷 전화 VOIP 광고 MVNO 이동 통신 서비스 방송 통신 서비스 가입자 제공 종합 유선 방송 사업자 오리지널 대표 콘텐츠 투자 지역 채널 인기도 OEM 제조 상품 렌탈 사업 영위 LG 유플러스 주요 종속 회사 미디어로 설립 인터넷 통신서비스 멀티미디어컨텐츠 제작 인터넷포탈서비스 영위 별정 통신 사업 등록 알뜰폰 MVNO 사업 영위 동사 LG그룹 계열사 무선 스마트 기업 서비스 시장 통신 사업 영위 엘지 헬리 보지 아인텔레서비스 미디어 로그 연결 대상 종속 회사 보유 분기 별도 기준 서비스 수익 무선 서비스 비중 스마트 기업 인프라 전화 서비스 수익 년 분기 기준 시장 점유율 무선 서비스 초고 인터넷 ,6
52,현대글로비스,86280,"동사는 2001년 2월 22일에 설립되었으며, 2005년 12월 26일 유가증권시장에 상장되었음.","동사는 종합물류업과 유통판매업, 해운업을 영위하고 있으며, 현대자동차그룹에 속한 회사임. 2021년 2분기 기준 매출액 대비 매출비중은 종합물류업 32.85%, 유통판매업 53.89%, 해운업 13.27%임.",2015년 국내 물류기업 최초로 다우존스지속가능경영지수에 편입이후 5년 연속 지위를 유지 중,"동사는 2001년 2월 22일에 설립되었으며, 2005년 12월 26일 유가증권시장에 상장되었음. 동사는 종합물류업과 유통판매업, 해운업을 영위하고 있으며, 현대자동차그룹에 속한 회사임. 2021년 2분기 기준 매출액 대비 매출비중은 종합물류업 32.85%, 유통판매업 53.89%, 해운업 13.27%임. 2015년 국내 물류기업 최초로 다우존스지속가능경영지수에 편입이후 5년 연속 지위를 유지 중","동사는 설립되었으며, 유가증권시장에 상장되었음.동사는 종합물류업과 유통판매업, 해운업을 영위하고 있으며, 현대자동차그룹에 속한 회사임.기준 매출액 대비 매출 비중은 종합물류업 유통 판매업 해운업 국내 물류기업 최초로 다우존스 지속가능경영지수에 편입 이후 연속 지위를 유지중","['동사', '2월 22일', '설립', '12월 26일', '유가증권', '시장', '상장', '동사', '종합', '물류업', '유통', '판매업', '해운', '영위', '현대자동차그룹', '회사', '분기', '기준', '매출액', '대비', '매출', '비중', '종합', '물류업', '유통', '판매업', '해운', '임', '국내', '물류', '기업', '최초', '다우존스', '지속', '가능', '경영', '지수', '편입', '이후', '연속', '지위', '유지']",동사 2월 22일 설립 12월 26일 유가증권 시장 상장 동사 종합 물류업 유통 판매업 해운 영위 현대자동차그룹 회사 분기 기준 매출액 대비 매출 비중 종합 물류업 유통 판매업 해운 임 국내 물류 기업 최초 다우존스 지속 가능 경영 지수 편입 이후 연속 지위 유지 ,운수창고,육상운수,사업 개요 당사 영위 사업 종합 물류업 유통 판 매업 해운업 종합 물류업 고객 화물 운송 서비스 제공 사업 국내 물류 해외 물류 구분 유통 판매업 CKD 부품 공급 사업 도매 형태 중고차 경매 수출 중고차 사업 원자재 수출입 중계 무역 트레이딩 사업 구분 해운업 선박 이용 화물 운송 사업 완성차 운송 벌크 운송 구분 반기말 기준 연결 매출액 종합 물류업 유통 판 매업 해운업 당사 주요 매출처 현 대 자동차 주 기아 주 종합 물류업 경제 전반 구성 물 요소 흐름 관련 사업 생산지 소비지 물품 정보 흐름 저장 효율 계획 통제 실행 프로세스 말 당사 고객 화물 운송 보관 하역 물류 컨설팅 물류 관련 업무 총괄 담당 글로벌 물류 네트워크 기반 첨단 물류 정보 시스템 전문 인력 활용 ONE STOP TOTAL LOGISTICS SERVICE 제공 고객 가치 극대 당사 종합 물류업 발생 지역 국내 물류 해외 물류 구분 품목 수출 입물 완성 차물 부품 물류 벌크 물류 수행 유통 판 매업 CKD 사업 COMPLETE KNOCK DOWN 완제품 반제품 자동차 부품 수출 사업 해외 공장 국내외 부품 주문 접수 발주 집하 포장 후 컨테이너 작업 해상 항공 운송 현지 공장 납입 리드타임 단축 적시납입 체계 포장품질 유지 포장 표준 물류비 절감 전략 중요 요소 당사 CKD 사업 현 대 자동차 기아 중심 해외 완성차 공장 조립 생산 자동차 부품 국내외 협력사 발주 조달 포장 후 공장 통관 운송 판매 사업 부품 발주 포장 운송 현지 재고 관리 즉시 납입 종합 유통 서비스 제공 현지 공장 생산 향상 기여 유통 판 매업 중고차 사업 국내 최대 중고차 경매장 운영 당사 중고차 매입 전문 서비스 오토벨 중고차 매입 시세 산출 거래 중개 담당 사업 한 글로벌 네트워크 기반 중고차 수출 해외 중고차 유통 사업 영역 확장 추진 당사 중고차 사업 주요 부문 경매 개인 법인 신차구입 렌터카 리스 운용 업체 자산 매각 밀접 연관 경쟁 입찰 차량 매각 매도자 입장 매매 업체 개별 매도 경쟁력 가격 신뢰 사후 관리 장점 유통 판 매업 트레이딩 사업 산업 필수 소재 알루미늄 구리 수출입 삼국간 중계 무역 철 금속 트레이딩 사업 당사 주요 거래 선 중동 아태 신성장 지역 원자재 수입 내수 판매 국내 제품 해외 수출 당사 기 보유 물류 인프라 유통 역량 기반 트레이딩 사업 추진 해운업 선박 이용 고객 화물 지정 장소 운송 서비스 산업 선박 확보 규모 자금 투자 필요 자본 집약 산업 당사 해운사업 완성차 운송 벌크 운송 구분 완성차 운송 사업 PCTC 자동 차선 이용 승용차 상용차 특수 차량 건설 중장비 철도 차량 운송 벌크 운송 사업 벌크선 이용 철광석 석탄 곡물 DRY BULK 화물 운송 탱커선 이용 원유 석유 제품 가스선 이용 LNG WET BULK 화물 운송 수행 당사 완성차 운송 사업 본사 해외 네트워크 효율 업무 협력 세계 다양 항로 개발 노선 확대 경쟁력 지속 강화 바탕 현대 차그룹 외 VW TESLA FORD BMW GM DAIMLER 글로벌 완성 차업체 중고차 화물 수송 결과 매출 비중 반기 상회 수준 확대 벌크 운송 사업 적극 서비스 마인드 고객 유대 강화 바탕 장기 계약 위주 사업 전략 추진 DRY BULK 서부 발전 남동 발전 OCP 국내외 화 주 WET BULK 현대 오일뱅크 GS CALTEX 국내 대형 정 유사 장기 계약 체결 노르웨이 FREDRIKSEN 그룹 FLEX LNG 계약 LNG 선 시장 진출 향후 친환경 너지 운송 사업 지속 확대 추진 예정 동사 2월 22일 설립 12월 26일 유가증권 시장 상장 동사 종합 물류업 유통 판매업 해운 영위 현대자동차그룹 회사 분기 기준 매출액 대비 매출 비중 종합 물류업 유통 판매업 해운 임 국내 물류 기업 최초 다우존스 지속 가능 경영 지수 편입 이후 연속 지위 유지 ,6
53,LG디스플레이,34220,"동사는 TFT-LCD 및 OLED 등의 기술을 활용한 Display 관련 제품을 생산, 판매하는 사업을 영위하고 있으며, Display 단일 사업부문으로 구성되어 있음.","대부분의 제품을 해외로 판매하고 있으며, 플렉서블 OLED 스마트폰, Wearable용 원형 OLED 패널 등을 출시하고 있음.","파주와 구미에 TFT-LCD 및 OLED 공장과 연구소를 보유하고 있으며, 미주, 유럽 및 아시아에 해외 현지법인을 두고 있음.","동사는 TFT-LCD 및 OLED 등의 기술을 활용한 Display 관련 제품을 생산, 판매하는 사업을 영위하고 있으며, Display 단일 사업부문으로 구성되어 있음. 대부분의 제품을 해외로 판매하고 있으며, 플렉서블 OLED 스마트폰, Wearable용 원형 OLED 패널 등을 출시하고 있음. 파주와 구미에 TFT-LCD 및 OLED 공장과 연구소를 보유하고 있으며, 미주, 유럽 및 아시아에 해외 현지법인을 두고 있음.","동사는 TFT-LCD 및 OLED 등의 기술을 활용한 Display 관련 제품을 생산, 판매하는 사업을 영위하고 있으며, Display 단일사업부문으로 구성되어 있음.대부분의 제품을 해외로 판매하고 있으며, 플렉서블 OLED 스마트폰, Wearable용 원형 OLED 패널 등을 출시하고 있음. 파주와 구미에 TFT-LCD 및 OLED 공장과 연구소를 보유하고 있으며, 미주, 유럽 및 아시아에 해외 현지법인을 두고 있음.","['동사', '기술', '활용', '관련', '제품', '생산', '판매', '사업', '영위', '단일', '사업', '부문', '구성', '대부분', '제품', '해외', '판매', '플렉서블', '스마트폰', '원형', '패널', '출시', '파주', '구미', '공장', '연구소', '보유', '미주', '유럽', '아시아', '해외', '현지', '법인']",동사 기술 활용 관련 제품 생산 판매 사업 영위 단일 사업 부문 구성 대부분 제품 해외 판매 플렉서블 스마트폰 원형 패널 출시 파주 구미 공장 연구소 보유 미주 유럽 아시아 해외 현지 법인 ,"전기,전자",디스플레이 및 관련부품,당사 OLED TFT LCD 디스플레이 기술 활용 관련 제품 연구 개발 제조 판매 반기 누적 기준 자사 주요 판매 제품군 매출 비중 TV IT MOBILE 기타 부분 GLOBAL SET MAKER 고객 상위 고객 사향 매출 전체 매출 약 차지 당사 수출 주력 기업 반기 누적 기준 해외 매출 비중 약 미국 독일 일본 대만 중국 싱가포르 지역 판매 법인 고객 밀착 지원 국내 중국 베트남 생산 법인 생산 능력 글라 스 기준 연간 수준 OLED 차별 경쟁력 제품 생산 능력 확대 현금 지출 기준 연간 약 중반 규모 설비 투자 집행 금년도 연간 초반 설비 투자 집행 계획 DISPLAY 패널 생산 주요 원재료 GLASS 반도 체류 편광판 유기물 BACK LIGHT PCB 원재료 가격 시장 수급 상황 당사 구매 물량 변화 변동 당사 디스플레이 산업 규모 투자 생산 능력 확보 장기간 소요 생산 능력 확대 수요 성장간 균형 발생 패널 가격 등락 업체 영업 실적 생산 능력 기술 제품 개발 역량 생산 효율 품질 관리 고객 관계 구축 경쟁력 차이 활용 판매 가격 차별 당사 해외 판매 비중 매출 달러 원재료 구매 미 달러화 엔화 위안 환율 변동 영업 실적 변동 외화 표시 자산 부채 영업 현금 흐름 환율 변동 리스크 최소 관리 당사 매출액 대비 연구 개발비 비중 제품 기술 체계 연구 개발 활동 고객 가치 지속 창출 연구 개발 활동 경쟁력 바탕 TV 용 OLED 자동 차용 PLASTIC OLED 제품 산업 당사 차별 기술 바탕 유일 양산 OLED TFT LCD 활용 TV IT MOBILE 자동 차용 산업 다양 제품 영역 차별 가치 제공 디스플레이 산업 선도 동사 기술 활용 관련 제품 생산 판매 사업 영위 단일 사업 부문 구성 대부분 제품 해외 판매 플렉서블 스마트폰 원형 패널 출시 파주 구미 공장 연구소 보유 미주 유럽 아시아 해외 현지 법인 ,13
54,강원랜드,35250,"국내에서 유일하게 내국인이 출입가능한 카지노, 고품격 호텔과 컨벤션센터 및 콘도, 스키장, 골프장 등을 갖추고 있음.","리조트 사업의 지속적인 성장을 도모하고자 하이원 워터월드를 개장하였으며 봄 야생화 카트 투어, 여름 워터월드, 가을 하늘길 트레킹, 겨울 스키장 등 사계절 즐길 거리를 갖추고 있음.",한국관광공사 선정 가을 비대면 관광지인 '하늘길 트레킹' 등을 운영하고 있음.,"국내에서 유일하게 내국인이 출입가능한 카지노, 고품격 호텔과 컨벤션센터 및 콘도, 스키장, 골프장 등을 갖추고 있음. 리조트 사업의 지속적인 성장을 도모하고자 하이원 워터월드를 개장하였으며 봄 야생화 카트 투어, 여름 워터월드, 가을 하늘길 트레킹, 겨울 스키장 등 사계절 즐길 거리를 갖추고 있음. 한국관광공사 선정 가을 비대면 관광지인 '하늘길 트레킹' 등을 운영하고 있음.","국내에서 유일하게 내국인이 출입 가능한 카지노, 고품격 호텔과 컨벤션센터 및 콘도, 스키장, 골프장 등을 갖추고 있음.리조트 사업의 지속적인 성장을 도모하고자 하이원 워터월드를 개장하였으며 봄 야생화 카트 투어, 여름 워터월드, 가을 하늘길 트레킹, 겨울 스키장 등 사계절 즐길거리를 갖추고 있음. 한국 관광공사 선정 가을 비대면 관광지인 '하늘길 트레킹' 등을 운영하고 있음.","['국내', '유일', '내국인', '출입', '카지노', '품격', '호텔', '컨벤션', '센터', '콘도', '스키장', '골프장', '리조트', '사업', '지속', '성장', '도모', '하이', '워터월드', '개장', '야생화', '카트', '투어', '여름', '워터월드', '하늘', '트레킹', '겨울', '스키장', '사계절', '거리', '한국관광공사', '선정', '비대', '관광지', '하늘', '트레킹', '운영']",국내 유일 내국인 출입 카지노 품격 호텔 컨벤션 센터 콘도 스키장 골프장 리조트 사업 지속 성장 도모 하이 워터월드 개장 야생화 카트 투어 여름 워터월드 하늘 트레킹 겨울 스키장 사계절 거리 한국관광공사 선정 비대 관광지 하늘 트레킹 운영 ,서비스업,호텔 및 레저,가 사업 개요 연결 회사 사업 카지노 부문 숙박 레저 리조트 부문 기타 부문 다음 의표 구성 당사 카지노 폐 광 지역 개발 지원 특별법 의거 국내 유일 내국인 외국인 출입 동시 허용 영업장 회원 VIP 영업장 일반 영업장 테이블 전자테이블 포함 슬롯머 신 게임 기구 보유 기준 카지노 매출 전체 매출 차지 일평균 방문 카 지노 시설 운영 매출 영업 전반 문화 체육 관광부 사행 산업 통합 감독 위원회 당국 규제 감독 당사 관련 법규 지침 성실 사업 특성 발생 사회 부작용 최소 건전 게임문화 정착 다양 정책 추진 청정 자연 속 고원 지대 위치 하 이원리조트 호텔 콘도 스키 골프 워터 파크 카지노 곳 자리 국내 최대 복합리조트 리조트 매출 비중 기준 전체 매출 차지 카지노 영향 호텔 영업 매출 비중 계절 여름 겨울 휴가 방학 시즌 리조트 매출 방문객 증가 경향 당사 우수 리조트 시설 산림 관광 자원 지역 관광인프라 활용 숙박 레저 힐링 액티비티 컨벤션 다양 복합 상품 기획 판매 루지 탄광 문화 공원 방문객 증대 거리 컨텐츠 확대 지속 지속 가능 성장 동력 카지 노업 기반 슬롯머신 하드웨어 소프트웨어 제조 사업 병행 국내외 카지노 판매 자회사 폐선 철도 활용 철도테마 놀이 기구 숙박 시설 주 하이 원추추파크 강원랜드 시설 유지 관리 담당 주 하이 원파트 너스 현재 계속 코로 관련 사회 거리 정책 제한 영업 카지노 리조트 예년 대비 매출 감소 폭 상황 정부 사회 거리 두 단계 변화 카지노 매출 방문객수 증감 영향 거리 두 단계 완화 시 매출 방문 객수 증가 강화 시 감소 흐름 국내 유일 내국인 출입 카지노 품격 호텔 컨벤션 센터 콘도 스키장 골프장 리조트 사업 지속 성장 도모 하이 워터월드 개장 야생화 카트 투어 여름 워터월드 하늘 트레킹 겨울 스키장 사계절 거리 한국관광공사 선정 비대 관광지 하늘 트레킹 운영 ,1
55,코웨이,21240,"1989년 창립 이래, 1998년 혁신적인 렌탈 비즈니스 개념을 업계 최초로 도입하였으며,정수기, 공기청정기, 비데 등 환경가전 제품을 생산, 판매하는 환경가전 전문기업임.","정수기, 공기청정기, 비데, 연수기에서 매트리스, 의류청정기, 전기레인지 등으로 렌탈 제품 Line-up을 지속적으로 확대해 나가고 있음.","말레이시아,미국, 중국, 태국, 인도네시아, 베트남에서 동종업종을 영위하는 6개의 해외법인을 가지고 있음.","1989년 창립 이래, 1998년 혁신적인 렌탈 비즈니스 개념을 업계 최초로 도입하였으며,정수기, 공기청정기, 비데 등 환경가전 제품을 생산, 판매하는 환경가전 전문기업임. 정수기, 공기청정기, 비데, 연수기에서 매트리스, 의류청정기, 전기레인지 등으로 렌탈 제품 Line-up을 지속적으로 확대해 나가고 있음. 말레이시아,미국, 중국, 태국, 인도네시아, 베트남에서 동종업종을 영위하는 6개의 해외법인을 가지고 있음.","창립 이래, 혁신적인 렌탈 비즈니스 개념을 업계 최초로 도입하였으며, 정수기, 공기청정기, 비데 등 환경가전 제품을 생산, 판매하는 환경가전 전문기업임.정수기, 공기청정기, 비데, 연수기에서 매트리스, 의류청정기, 전기레인지 등으로 렌탈 제품 Line-up을 지속적으로 확대해 나가고 있음.말레이시아, 미국, 중국, 태국, 인도네시아, 베트남에서 동종 업종을 영위하는 해외법인을 가지고 있음.","['창립', '혁신', '비즈니스', '개념', '업계', '최초', '도입', '정수기', '공기', '청정기', '비데', '환경', '가전', '제품', '생산', '판매', '환경', '가전', '전문', '기업', '정수기', '공기', '청정기', '비데', '연수기', '매트리스', '의류', '청정기', '전기레인지', '레', '제품', '지속', '확대', '말레이시아', '미국', '중국', '태국', '인도네시아', '베트남', '동종', '업종', '영위', '해외', '법인']",창립 혁신 비즈니스 개념 업계 최초 도입 정수기 공기 청정기 비데 환경 가전 제품 생산 판매 환경 가전 전문 기업 정수기 공기 청정기 비데 연수기 매트리스 의류 청정기 전기레인지 레 제품 지속 확대 말레이시아 미국 중국 태국 인도네시아 베트남 동종 업종 영위 해외 법인 ,서비스업,내구소비재,당사 창립 이 정수기 공기 청정기 비데 환경 가전 제품 생산 판매 환경 가전 전문 기업 환경 가전 제품 대중 트렌드 주도 업계 최대 생산 시설 R D 센터 보유 우수 제품 개발 역량 소비자 건강 생활 부합 제품 지속 개발 생산 당사 지속 국내 최고 위치 국내 기준 약 렌탈 멤버쉽 계정 확보 당사 사업 부문 렌탈 일시불 기타 부문 분류 당사 매출액 렌탈 매출 전체 차지 일시불 매출 기타 매출 해당 당사 환경 기술 연구소 TQA 실 협력 업체 기술 개발 노력 부품 국산 성공 대부분 국내 조달 필터 자동 생산라인 주요 매입 원재료 PBA 아세이 컴프레샤 당사 제품 유구 공장 인천공 장 포천 공장 생산 당사 국내 거점 말레이시아 미국 중국 태국 인도네시아 베트남 일본 유럽 해외 종속 회사 동종 사업 영위 수처리 기기 산업 설비 제조업 코웨이엔텍 포천 장자산 단 공업 용수 공급 건설 운용업 포천맑 물 공업 용수 시설 설계 운영업 미추홀 물 가구류 제 조업 아이오 베드 영위 종속 기업 사업 내용 사항 주요 제품 서비스 기타 참고 사항 내용 참고 창립 혁신 비즈니스 개념 업계 최초 도입 정수기 공기 청정기 비데 환경 가전 제품 생산 판매 환경 가전 전문 기업 정수기 공기 청정기 비데 연수기 매트리스 의류 청정기 전기레인지 레 제품 지속 확대 말레이시아 미국 중국 태국 인도네시아 베트남 동종 업종 영위 해외 법인 ,13
